company,date,purpose,symbol,bm_desc
MIC Electronics Limited,25-Apr-2026,Financial Results/Other business matters,MICEL,"To consider and approve the financial results for the period ended March 31, 2026 and other business matters"
Mirza International Limited,25-Apr-2026,Other business matters,MIRZAINT,To Consider and take in-principle decision in relation to a proposed restructuring of the Company's business through a Scheme of Arrangement
RBL Bank Limited,25-Apr-2026,Financial Results/Dividend,RBLBANK,"To consider and approve the financial results for the period ended March 31, 2026 and dividend"
Sampann Utpadan India Limited,25-Apr-2026,Financial Results,SAMPANN,"To consider and approve the financial results for the period ended March 31, 2026"
Sanginita Chemicals Limited,25-Apr-2026,Financial Results,SANGINITA,"To consider and approve the financial results for the period ended March 31, 2026"
SBFC Finance Limited,25-Apr-2026,Financial Results/Fund Raising,SBFC,"To consider and approve the financial results for the period ended March 31, 2026 and increase in borrowing limits including but not limited to Non-Convertible Debentures or such other debt securities."
SBFC Finance Limited,25-Apr-2026,Fund Raising,SBFC,To consider Fund Raising through NCDs
Sejal Glass Limited,25-Apr-2026,Financial Results,SEJALLTD,"To consider and approve the financial results for the quarter and year ended March 31, 2026"
UCO Bank,25-Apr-2026,Financial Results/Dividend/Fund Raising,UCOBANK,"To consider and approve the financial results for the period ended March 31, 2026, dividend and Fund Raising"
Avantel Limited,26-Apr-2026,Financial Results/Dividend,AVANTEL,"To consider and approve the financial results for the period ended March 31, 2026 and dividend"
Affordable Robotic & Automation Limited,27-Apr-2026,Other business matters,AFFORDABLE,To consider other business matters
AGI Greenpac Limited,27-Apr-2026,Financial Results/Dividend/Other business matters,AGI,"To consider and approve the financial results for the quarter and year ended March 31, 2026, dividend and other business matters"
Astec LifeSciences Limited,27-Apr-2026,Financial Results,ASTEC,"To consider and approve the financial results for the period ended March 31, 2026"
Adani Total Gas Limited,27-Apr-2026,Financial Results/Dividend,ATGL,"To consider and approve the audited financial results for the quarter and financial year ended March 31, 2026 and to recommend dividend, if any, on the equity shares of the Company for the financial year 2025-26."
AU Small Finance Bank Limited,27-Apr-2026,Financial Results/Dividend/Fund Raising,AUBANK,"The meeting of the Board of Directors of the Bank will be held on Monday, April 27, 2026, to, inter alia, consider and approve the following:1. Audited Financial Results of the Bank for the Quarter and Financial Year ended on March 31, 2026.2. Recommend Dividend on equity shares, if any, for the financial year ended on March 31, 2026.3. Passing an enabling resolution for annual renewal of fund raising limits by way of:a) issuance of equity shares through private placement or qualified institutions placement (QIP) or preferential allotment or through a combination thereof or any other alternative mode, as may be considered appropriate, subject to necessary approvals and requirements, as applicable.b) issuance of debt instruments including but not limited to Bonds and Non-Convertible Debentures or such other debt securities as may be permitted by RBI from time to time, subject to necessary approvals and requirements, as applicable.Please refer attachment for further details."
Aye Finance Limited,27-Apr-2026,Financial Results,AYE,"To consider and approve the financial results for the period ended March 31, 2026"
Bajaj Housing Finance Limited,27-Apr-2026,Financial Results,BAJAJHFL,"To consider and approve the financial results for the period ended March 31, 2026"
Coal India Limited,27-Apr-2026,Financial Results/Dividend,COALINDIA,"To consider and approve the financial results for the period ended March 31, 2026 and dividend"
Canara Robeco Asset Management Company Limited,27-Apr-2026,Financial Results,CRAMC,"To consider and approve the financial results for the quarter and year ended March 31, 2026"
Canara Robeco Asset Management Company Limited,27-Apr-2026,Dividend,CRAMC,To consider & recommend the final dividend
City Union Bank Limited,27-Apr-2026,Financial Results/Dividend/Bonus,CUB,"To consider and approve the financial results for the period ended March 31, 2026, dividend and bonus shares if any, subject to approval of shareholders of the bank."
Prataap Snacks Limited,27-Apr-2026,Financial Results/Dividend/Other business matters,DIAMONDYD,"To consider and approve the financial results for the period ended March 31, 2026, dividend and other business matters"
Fabtech Technologies Limited,27-Apr-2026,Dividend,FABTECH,"To consider dividend for the Financial Year ended March 31, 2026."
Fabtech Technologies Limited,27-Apr-2026,Financial Results,FABTECH,"To consider and approve the financial results for the period ended March 31, 2026"
Garden Reach Shipbuilders & Engineers Limited,27-Apr-2026,Financial Results/Dividend,GRSE,"In terms of Regulation 29 of the SEBI (Listing Obligations and Disclosure Requirements) Regulations, 2015, as amended (the  SEBI Listing Regulations ), we wish to inform you that a meeting of the Board of Directors of the Company is scheduled to be held on Monday, 27th April, 2026, inter alia, to consider and approve Audited Financial Results for the quarter and year ended 31st March, 2026 and to recommend final dividend for the Financial Year 2025-26, if any.Accordingly, the Trading Window for dealing in securities of the Company shall remain closed for all Insiders including Designated Person, Connected Person and their immediate relatives from 01st April, 2026 to 29th April, 2026.This is for your information and record."
Heranba Industries Limited,27-Apr-2026,Other business matters,HERANBA,"To consider and approve the proposal for conversion of Inter Corporate Deposits (ICD) granted by the Company to its wholly owned subsidiary Heranba Organics Private Limited ( HOPL ), into Optionally Fully Convertible Debentures (OFCDs) on such terms and conditions as may be approved."
Huhtamaki India Limited,27-Apr-2026,Financial Results,HUHTAMAKI,"To consider and approve the financial results for the period ended March 31, 2026"
Jagsonpal Pharmaceuticals Limited,27-Apr-2026,Financial Results/Dividend,JAGSNPHARM,"To consider and approve the financial results for the period ended March 31, 2026 and dividend"
Jindal Saw Limited,27-Apr-2026,Financial Results/Dividend,JINDALSAW,"To consider and approve the financial results for the period ended March 31, 2026 and dividend"
Kirloskar Pneumatic Company Limited,27-Apr-2026,Stock Split,KIRLPNU,To consider stock split of equity shares
Kirloskar Pneumatic Company Limited,27-Apr-2026,Financial Results/Dividend,KIRLPNU,"To consider and approve the financial results for the period ended March 31, 2026 and dividend"
Kotyark Industries Limited,27-Apr-2026,Financial Results/Dividend/Other business matters,KOTYARK,"To consider and approve the financial results for the period ended March 31, 2026, dividend and other business matters"
Mahindra Holidays & Resorts India Limited,27-Apr-2026,Financial Results,MHRIL,"To consider and approve the financial results for the period ended March 31, 2026"
Nippon Life India Asset Management Limited,27-Apr-2026,Financial Results/Dividend,NAM-INDIA,"Nippon Life India Asset Management Ltd has informed that the meeting of the Board of Directors of the Company is scheduled on 27/04/2026 ,inter alia, to consider and approve Audited Financial Results for the quarter and year ending March 31, 2026 and to recommend dividend on equity shares, if any."
North Eastern Carrying Corporation Limited,27-Apr-2026,Other business matters,NECCLTD,To consider other business matters
The Phoenix Mills Limited,27-Apr-2026,Financial Results,PHOENIXLTD,"To consider and approve the Audited Standalone and Consolidated financial results for the quarter and financial year ended March 31, 2026."
The Phoenix Mills Limited,27-Apr-2026,Dividend,PHOENIXLTD,Intimation regarding recommendation of final dividend at the upcoming meeting of Board of Directors of The Phoenix Mills Limited ( the Company )
Piramal Finance Limited,27-Apr-2026,Financial Results/Dividend,PIRAMALFIN,"Audited Financial Results (Standalone and Consolidated) for the quarter and financial year ended 31st March 2026 and recommendation of Dividend on Equity Shares, if any, for the said year"
Plastiblends India Limited,27-Apr-2026,Financial Results/Dividend,PLASTIBLEN,"To consider and approve the financial results for the period ended March 31, 2026 and dividend"
Punjab & Sind Bank,27-Apr-2026,Financial Results/Dividend,PSB,"To consider and approve the financial results for the period ended March 31, 2026 and dividend"
Rallis India Limited,27-Apr-2026,Financial Results/Dividend,RALLIS,"To consider and approve the financial results for the period ended March 31, 2026 and dividend"
Rossari Biotech Limited,27-Apr-2026,Financial Results/Dividend,ROSSARI,"Rossari Biotech Limited has informed NSE that the meeting of Board of Directors of the Company is scheduled on 27/04/2026, inter alia, to consider and approve, 1. Audited Financial Statements and Financial Results (Standalone and Consolidated) of the Company for the Quarter and Financial Year ended March 31, 2026. 2. recommend payment of Final Dividend, if any, for the Financial Year ended March 31, 2026."
SBI Cards and Payment Services Limited,27-Apr-2026,Financial Results,SBICARD,"To consider and approve the financial results for the period ended March 31, 2026"
Shekhawati Industries Limited,27-Apr-2026,Financial Results,SHEKHAWATI,"To consider and approve the financial results for the period ended March 31, 2026"
Supreme Industries Limited,27-Apr-2026,Financial Results/Dividend,SUPREMEIND,"To consider and approve the Audited financial results for the financial year ended March 31, 2026 and  recommendation of dividend, if any"
Tamilnad Mercantile Bank Limited,27-Apr-2026,Financial Results/Dividend,TMB,"To consider and approve the financial results for the period ended March 31, 2026 and dividend"
UltraTech Cement Limited,27-Apr-2026,Financial Results/Dividend,ULTRACEMCO,"To consider and approve the Standalone and Consolidated Audited Financial Results of the Company for the year ending 31st March, 2026 and recommend dividend, if any, on the equity shares of the Company for the year ending 31st March, 2026."
UMIYA BUILDCON LIMITED,27-Apr-2026,Financial Results,UMIYA-MRO,"To consider and approve the financial results for the period ended March 31, 2026"
Unicommerce Esolutions Limited,27-Apr-2026,Financial Results,UNIECOM,"To consider and approve the financial results for the Quarter and Financial year period ended on March 31, 2026"
Varun Beverages Limited,27-Apr-2026,Financial Results/Dividend,VBL,"Pursuant to the provisions of Regulation 29 of the SEBI (Listing Obligations and Disclosure Requirements) Regulations, 2015, we wish to inform you that a meeting of the Board of Directors of the Company will be held on Monday, April 27, 2026 inter-alia to consider and approve the following:(i) Unaudited Financial Results of the Company, both on Standalone and Consolidated basis, for the Quarter ended March 31, 2026. (ii) Declaration of interim dividend to the Equity Shareholders of the Company for the Financial Year 2026.In continuation to our letter dated March 24, 2026 regarding the closure of Trading Window from April 1, 2026 till 48 hours after public announcement of the Unaudited Financial Results for the Quarter ended March 31, 2026, we wish to inform you that the Trading Window will be closed till April 29, 2026.Further, please note that the Company is following 1st January to 31st December as its Financial Year in terms of Section 2(41) of the Companies Act, 2013 as approved by the Company Law Board."
Websol Energy System Limited,27-Apr-2026,Financial Results/Dividend/Other business matters,WEBELSOLAR,"To consider and approve the financial results for the period ended March 31, 2026, dividend and other business matters"
AVG Logistics Limited,28-Apr-2026,Fund Raising,AVG,To consider Fund Raising
AWL Agri Business Limited,28-Apr-2026,Financial Results/Dividend,AWL,"To consider and approve the financial results for the period ended March 31, 2026 and dividend"
Bandhan Bank Limited,28-Apr-2026,Financial Results/Dividend,BANDHANBNK,"To consider and approve the Audited Financial Results of the Bank, for the Quarter (Q4) and Financial Year ended March 31, 2026, and to consider recommending Dividend, if any, for the said Financial Year."
Brigade Hotel Ventures Limited,28-Apr-2026,Financial Results,BRIGHOTEL,"To consider and approve the financial results for the period ended March 31, 2026"
Canara HSBC Life Insurance Company Limited,28-Apr-2026,Financial Results/Dividend,CANHLIFE,"To consider and approve the financial results for the period ended March 31, 2026 and dividend"
Castrol India Limited,28-Apr-2026,Financial Results,CASTROLIND,"To consider and approve the financial results for the period ended March 31, 2026"
Consolidated Construction Consortium Limited,28-Apr-2026,Financial Results,CCCL,"To consider and approve the financial results for the period ended March 31, 2026"
CEAT Limited,28-Apr-2026,Financial Results/Dividend/Other business matters,CEATLTD,"To consider and approve the financial results for the period ended March 31, 2026, dividend and other business matters"
Dalmia Bharat Limited,28-Apr-2026,Financial Results/Dividend/Other business matters,DALBHARAT,"To consider and approve the financial results for the period ended March 31, 2026, dividend and other business matters"
Deepak Builders & Engineers India Limited,28-Apr-2026,Stock Split/Other business matters,DBEIL,To consider stock split of equity shares and other business matters
Dhanlaxmi Bank Limited,28-Apr-2026,Financial Results,DHANBANK,"To consider and approve the financial results for the period ended March 31, 2026"
Emmvee Photovoltaic Power Limited,28-Apr-2026,Financial Results/Dividend,EMMVEE,"To consider and approve the financial results for the period ended March 31, 2026 and dividend (if any)"
ETERNAL LIMITED,28-Apr-2026,Financial Results,ETERNAL,"Eternal Limited has informed the Exchange about Board Meeting to be held on 28-April-2026 to inter-alia consider and approve the Audited Financial results of the Company for the year ended on March 31, 2026."
Fedbank Financial Services Limited,28-Apr-2026,Financial Results,FEDFINA,"To consider and approve the financial results for the Quarter and Financial Year ended March 31, 2026"
Five-Star Business Finance Limited,28-Apr-2026,Financial Results/Dividend,FIVESTAR,"To consider and approve the audited financial results for quarter and financial year ended March 31, 2026 and recommendation of  final dividend on the equity shares of the Company for the financial year ended March 31, 2026 for approval of shareholders."
Go Digit General Insurance Limited,28-Apr-2026,Financial Results,GODIGIT,To consider and approve the Audited Financial Results for the quarter and financial year ended 31st March 2026
Greenply Industries Limited,28-Apr-2026,Financial Results,GREENPLY,"To consider and approve the financial results for the period ended March 31, 2026 and to consider recommendation of dividend, if any, on equity shares for the year ended 31st March, 2026."
Garden Reach Shipbuilders & Engineers Limited,28-Apr-2026,Financial Results/Dividend,GRSE,"This has reference to our letter No. SECY/GRSE/BD-69/CA/01/26-27 dated 11 Apr 2026 on the subject matter of  Intimation of Date of Board Meeting to, inter alia, consider and approve, Audited Financial Results for the quarter and year ended 31st March, 2026 and to recommend final dividend for the financial year 2025-26, if any .This is to inform you that meeting of the Board of Directors of the Company, which is scheduled to be held on Monday, 27th April, 2026, has been rescheduled and now will be held on Tuesday, 28th April, 2026 due to unavoidable circumstances. Accordingly, the Trading Window for dealing in securities of the Company shall remain closed from 01st April, 2026 to 30th April, 2026.This is for your information and record."
IFCI Limited,28-Apr-2026,Financial Results,IFCI,"To consider and approve the standalone and consolidated financial results for the period ended March 31, 2026"
InfoBeans Technologies Limited,28-Apr-2026,Financial Results/Other business matters,INFOBEAN,"The Company has informed the Exchange that the meeting of the Board of Directors scheduled to be held on April 28, 2026 has been preponed by one hour and will now be held at 08:00 A.M. (IST) instead of 09:00 A.M. (IST)."
InfoBeans Technologies Limited,28-Apr-2026,Financial Results/Dividend,INFOBEAN,"To consider and approve the financial results for the period ended March 31, 2026 and dividend"
Interise Trust,28-Apr-2026,Financial Results/Dividend,INTERISE,"To consider and approve the financial results for the period ended March 31, 2026 and Distribution"
Mahindra Lifespace Developers Limited,28-Apr-2026,Financial Results/Dividend,MAHLIFE,"To consider and approve the financial results for the period ended March 31, 2026 and dividend"
Maruti Suzuki India Limited,28-Apr-2026,Financial Results/Dividend,MARUTI,"To consider and approve the financial results for the period ended March 31, 2026 and dividend"
Motherson Sumi Wiring India Limited,28-Apr-2026,Financial Results/Dividend,MSUMI,"To consider and approve the financial results for the period ended March 31, 2026 and dividend"
Orient Cement Limited,28-Apr-2026,Financial Results/Dividend,ORIENTCEM,"The Company has informed the exchange that the meeting of the Board of Directors is scheduled on 28/04/2026 ,inter alia, to consider and approve the Audited Financial Results  for the quarter and year ended on March 31, 2026 and to consider and recommend dividend, if any, on the equity shares of the Company for the Financial Year 2025-26"
Piccadily Agro Industries Limited,28-Apr-2026,Financial Results/Other business matters,PICCADIL,"To consider and approve the financial results for the period ended March 31, 2026 and other business matters"
Piramal Pharma Limited,28-Apr-2026,Financial Results,PPLPHARMA,"To consider and approve the Audited Financial Results (Standalone and Consolidated) of the Company for quarter and financial year ended 31st March, 2026."
Rajoo Engineers Limited,28-Apr-2026,Financial Results/Dividend,RAJOOENG,"To consider and approve the Audited Standalone and Consolidated financial results for the period ended March 31, 2026 and recommendation of final dividend."
Ratnaveer Precision Engineering Limited,28-Apr-2026,Fund Raising/Other business matters,RATNAVEER,To consider Fund Raising and other business matters
REC Limited,28-Apr-2026,Financial Results/Dividend,RECLTD,Intimation of Board Meeting.
Sanofi India Limited,28-Apr-2026,Financial Results,SANOFI,"To consider and approve the unaudited financial results for the period ended March 31, 2026"
Sanofi Consumer Healthcare India Limited,28-Apr-2026,Financial Results,SANOFICONR,"To consider and approve the Unaudited Financial Results of the Company for the quarter ended March 31, 2026"
Sapphire Foods India Limited,28-Apr-2026,Financial Results,SAPPHIRE,"To consider and approve the financial results for the period ended March 31, 2026"
Skipper Limited,28-Apr-2026,Financial Results/Dividend,SKIPPER,"To consider and approve the financial results for the period ended March 31, 2026 and dividend"
Star Health and Allied Insurance Company Limited,28-Apr-2026,Financial Results,STARHEALTH,"To consider and approve the financial results for the quarter and year ended March 31, 2026"
Leela Palaces Hotels & Resorts Limited,28-Apr-2026,Financial Results,THELEELA,"Meeting of the Board of Directors of the Company is scheduled on April 28, 2026, inter alia, to consider and approve the Audited Standalone and Consolidated Financial Results of the Company for the Quarter and Year ended March 31, 2026"
Vardhman Special Steels Limited,28-Apr-2026,Financial Results/Dividend,VSSL,"To consider and approve the audited financial results for the period ended March 31, 2026 and recommendation of dividend, if any."
Accelya Solutions India Limited,29-Apr-2026,Financial Results,ACCELYA,"To consider and approve the financial results for the period ended March 31, 2026"
Adani Power Limited,29-Apr-2026,Financial Results,ADANIPOWER,"To consider and approve the financial results for the period ended March 31, 2026"
Ador Welding Limited,29-Apr-2026,Financial Results/Dividend/Other business matters,ADOR,"To consider and approve the financial results for the period ended March 31, 2026, dividend and other business matters"
Aeroflex Enterprises Limited,29-Apr-2026,Other business matters,AEROENTER,To consider other business matters
Bajaj Finance Limited,29-Apr-2026,Fund Raising,BAJFINANCE,To consider Fund Raising
Bajaj Finance Limited,29-Apr-2026,Financial Results/Dividend,BAJFINANCE,"To consider and approve the financial results for the period ended March 31, 2026 and dividend"
Bansal Wire Industries Limited,29-Apr-2026,Financial Results,BANSALWIRE,"Bansal Wire Industries Limited has informed the Exchange regarding the Board Meeting to be held on April 29, 2026 to inter-alia, consider and approve the audited Financial results (Standalone and Consolidated) of the Company for the quarter and financial year ended March 31 2026"
California Software Company Limited,29-Apr-2026,Financial Results/Other business matters,CALSOFT,"To consider and approve the financial results for the period ended March 31, 2026 and other business matters"
Capital Small Finance Bank Limited,29-Apr-2026,Financial Results,CAPITALSFB,"To consider and approve the financial results for the period ended March 31, 2026"
Capital Small Finance Bank Limited,29-Apr-2026,Financial Results/Dividend,CAPITALSFB,"To consider and approve the financial results for the period ended March 31, 2026 and dividend"
Cemindia Projects Limited,29-Apr-2026,Financial Results/Dividend,CEMPRO,"To consider and approve the financial results for the period ended March 31, 2026 and dividend"
The Federal Bank  Limited,29-Apr-2026,Financial Results/Dividend,FEDERALBNK,"To consider and approve the financial results for the period ended March 31, 2026 and dividend, if any"
Fino Payments Bank Limited,29-Apr-2026,Financial Results,FINOPB,"To consider and approve the financial results for the period ended March 31, 2026"
FORCE MOTORS LTD,29-Apr-2026,Financial Results/Dividend,FORCEMOT,"To consider and approve the financial results for the period ended March 31, 2026 and dividend"
Geojit Financial Services Limited,29-Apr-2026,Financial Results/Dividend/Other business matters,GEOJITFSL,"To consider and approve the financial results for the period ended March 31, 2026, dividend if any and other business matters"
Granules India Limited,29-Apr-2026,Financial Results/Dividend,GRANULES,"To consider and approve the financial results for the period ended March 31, 2026 and dividend"
HEG Limited,29-Apr-2026,Financial Results/Dividend,HEG,"To consider and approve the financial results for the period ended March 31, 2026 and dividend"
Indiabulls Limited,29-Apr-2026,Financial Results,IBULLSLTD,"To consider and approve the financial results for the period ended March 31, 2026"
IIFL Finance Limited,29-Apr-2026,Financial Results/Fund Raising,IIFL,"IIFL Finance Limited informs the Exchanges regarding Prior Intimation of Board Meeting scheduled to be held on April 29, 2026 to consider and approve the financial results for the period ended March 31, 2026 and Fund Raising."
Indegene Limited,29-Apr-2026,Financial Results/Dividend,INDGN,"To consider and approve the financial results for the period ended March 31, 2026 and dividend"
Indian Bank,29-Apr-2026,Financial Results/Dividend/Fund Raising,INDIANB,"To consider and approve the audited financial results for the for the Fourth Quarter and Financial Year ended on 31st March 2026, dividend and Fund Raising"
Indus Infra Trust,29-Apr-2026,Financial Results/Other business matters,INDUSINVIT,"To consider and approve the financial information for the period ended March 31, 2026 and declaration of distribution for Q4-FY26."
Indian Overseas Bank,29-Apr-2026,Financial Results,IOB,"To consider and approve the financial results for the period ended March 31, 2026"
Jana Small Finance Bank Limited,29-Apr-2026,Financial Results,JSFB,"To consider and approve the financial results for the period ended March 31, 2026"
Kfin Technologies Limited,29-Apr-2026,Dividend,KFINTECH,"KFin Technologies Limited has informed that the meeting of the Board of Directors of the Company is scheduled on 29/04/2026, inter alia, to consider and approve financial results of the Company and also to consider and recommend final dividend, if any, for the financial year ended March 31, 2026."
Kfin Technologies Limited,29-Apr-2026,Financial Results,KFINTECH,"To consider and approve the standalone and consolidated audited financial results of the Company for the quarter and financial year ending March 31, 2026"
Lloyds Metals And Energy Limited,29-Apr-2026,Fund Raising,LLOYDSME,To consider Fund Raising by way of issuance of Debt Securities.
MAS Financial Services Limited,29-Apr-2026,Financial Results/Dividend/Fund Raising/Other business matters,MASFIN,"To consider and approve the financial results for the period ended March 31, 2026, dividend, Fund Raising and other business matters"
