company,date,purpose,symbol,bm_desc
Mindspace Business Parks REIT,29-Apr-2026,Financial Results/Other business matters,MINDSPACE,"Prior Intimation of the meeting of the Board of Directors of K Raheja Corp Investment Managers Private Limited (acting as the Manager to Mindspace Business Parks REIT) for the quarter and financial year ended March 31, 2026, scheduled to be held on Wednesday, April 29, 2026 and the Conference Call thereto"
MOIL Limited,29-Apr-2026,Financial Results/Dividend,MOIL,"MOIL : 29-Apr-2026 :  The Company has informed the Exchange that a Board meeting to be held on April 30, 2026 has been re-scheduled. Further, the Company has informed the Exchange that the meeting of the Board of Directors of the Company will be held on April 29, 2026, To consider and approve the financial results for the period ended March 31, 2026 and dividend"
Moksh Ornaments Limited,29-Apr-2026,Other business matters,MOKSH,"Intimation of Board Meeting under Regulation 29 of SEBI (Listing Obligation and Disclosure Requirements) Regulation, 2015."
Motilal Oswal Financial Services Limited,29-Apr-2026,Financial Results/Other business matters,MOTILALOFS,"To consider and approve the financial results for the period ended March 31, 2026 and other business matters"
MphasiS Limited,29-Apr-2026,Financial Results/Dividend,MPHASIS,"To consider and approve the financial results for the quarter and year ended March 31, 2026, along with the Auditor s Report thereon, the recommendation of dividend, if any, among other matters."
Mangalam Worldwide Limited,29-Apr-2026,Financial Results,MWL,Mangalam Worldwide Limited has informed the Exchange about Board Meeting to be held on 29-Apr-2026 to consider and approve the Yearly Audited Financial results of the Company for the period ended 31st March 2026 and Dividend/Other business
Mangalam Worldwide Limited,29-Apr-2026,Dividend,MWL,"Mangalam Worldwide Limited has informed the Exchange to recommend a final dividend on the Equity Shares of the Company for the financial year ended March 31, 2026 at their Board Meeting to be held on 29th April, 2026."
Navin Fluorine International Limited,29-Apr-2026,Financial Results/Dividend,NAVINFLUOR,"Pursuant to Regulation 29 of SEBI (Listing Obligations and Disclosure Requirements) Regulations, 2015, this is to inform you that a Meeting of the Board of Directors of the Company is scheduled to be held on Wednesday, April 29, 2026, inter-alia, to consider, approve and take on record, the Annual Audited Standalone and Consolidated Financial Results of the Company for the Financial Year ending March 31, 2026; and to consider and recommend final dividend for the Financial Year 2025-2026."
New Delhi Television Limited,29-Apr-2026,Financial Results,NDTV,"To consider and approve the Audited Financial Results (Standalone and Consolidated) of the Company for the quarter and year ended March 31, 2026"
Panache Digilife Limited,29-Apr-2026,Financial Results,PANACHE,"To consider and approve the financial results for the period ended March 31, 2026"
Ravindra Energy Limited,29-Apr-2026,Financial Results,RELTD,"To consider and approve the financial results for the period ended March 31, 2026"
RPG Life Sciences Limited,29-Apr-2026,Financial Results/Dividend,RPGLIFE,"To consider and approve the financial results for the period ended March 31, 2026 and dividend"
Sadhana Nitrochem Limited,29-Apr-2026,Fund Raising/Other business matters,SADHNANIQ,To consider Fund Raising and other business matters
Schaeffler India Limited,29-Apr-2026,Financial Results,SCHAEFFLER,"To consider and approve the Unaudited financial results for the period ended March 31, 2026"
Shree Digvijay Cement Co.Ltd,29-Apr-2026,Financial Results/Dividend,SHREDIGCEM,"To consider and approve the financial results for the period ended March 31, 2026 and dividend"
Sterlite Technologies Limited,29-Apr-2026,Financial Results/Dividend/Fund Raising,STLTECH,"To consider and approve the financial results for the period ended March 31, 2026, dividend and Fund Raising"
Summit Securities Limited,29-Apr-2026,Financial Results,SUMMITSEC,"To consider and approve the Audited financial Results (Standalone and Consolidated) for the quarter and financial year ended March 31, 2026"
Surana Solar Limited,29-Apr-2026,Financial Results,SURANASOL,"To consider and approve the financial results for the period ended March 31, 2026"
Syngene International Limited,29-Apr-2026,Financial Results/Dividend,SYNGENE,"To consider and approve the financial results for the period ended March 31, 2026 and dividend"
Systematix Corporate Services Limited,29-Apr-2026,Financial Results/Dividend,SYSTMTXC,"To consider and approve the financial results for the period ended March 31, 2026 and dividend"
Vakrangee Limited,29-Apr-2026,Financial Results,VAKRANGEE,"To consider and approve the Audited financial Statement for quarter and year ended March 31, 2026"
Vedanta Limited,29-Apr-2026,Financial Results,VEDL,"To consider and approve the financial results for the period ended March 31, 2026"
Waaree Energies Limited,29-Apr-2026,Financial Results,WAAREEENER,"Waaree Energies Limited has informed the Exchange that the meeting of the Board of Directors of the Company is scheduled to be held on 29/04/2026 ,inter alia, to consider and approve the Audited Financial Results (Standalone And Consolidated) of the Company for the Quarter and Year Ended March 31, 2026."
Waaree Energies Limited,29-Apr-2026,Dividend,WAAREEENER,"Waaree Energies Limited has informed the Exchange that the Board of Directors at its meeting scheduled to be held on Wednesday, April 29, 2026, will consider recommendation of Final Dividend for the Financial Year 2025 - 26, if any."
Waaree Energies Limited,29-Apr-2026,Fund Raising,WAAREEENER,"Waaree Energies Limited has informed the Exchange that in continuation to our earlier intimation dated April 21, 2026, the Board of Directors shall also consider and approve the proposal of raising of funds."
